[
  {
    "wrong": ["Petropavlovskaya Borschagovka"],
    "correct": "Petropavlivska Borshchahivka",
    "id": "petropavlivska_borshchahivka",
    "tags": ["geo"]
  },
  {
    "wrong": ["Sofievskaya Borschagovka"],
    "correct": "Sofiiivska Borshchahivka",
    "id": "sofiiivska_borshchahivka",
    "tags": ["geo"]
  },
  {
    "wrong": ["Korsun-Shevchenkovskiy", "Korsun-Shevchenkovsky"],
    "correct": "Korsun-Shevchenkivskyi",
    "id": "korsun_shevchenkivskyi",
    "tags": ["geo"]
  },
  {
    "wrong": ["Belgorod-Dnestrovskiy", "Bilhorod-Dnestrovsky"],
    "correct": "Bilhorod-Dnistrovskyi",
    "id": "bilhorod_dnistrovskyi",
    "tags": ["geo"]
  },
  {
    "wrong": ["Kamenka-Dneprovskaya"],
    "correct": "Kamianka-Dniprovska",
    "id": "kamianka_dniprovska",
    "tags": ["geo"]
  },
  {
    "wrong": ["Murovanye Kurylovtsy"],
    "correct": "Murovani Kurylivtsi",
    "id": "murovani_kurylivtsi",
    "tags": ["geo"]
  },
  {
    "wrong": [
      "Vladimir Zelenskiy",
      "Volodimir Zelenskyy",
      "Volodymyr Zelenskiy",
      "Volodymyr Zelensky"
    ],
    "correct": "Volodymyr Zelenskyy",
    "id": "volodymyr_zelenskyy",
    "tags": ["names"]
  },
  {
    "wrong": ["Kamenets-Podolskiy", "Kamianets-Podolskyi", "Kamyanets-Podilskyi"],
    "correct": "Kamianets-Podilskyi",
    "id": "kamianets_podilskyi",
    "tags": ["geo"]
  },
  {
    "wrong": ["Klavdiyevo-Tarasove", "Klavdiyevo-Tarasovo"],
    "correct": "Klavdiievo-Tarasove",
    "id": "klavdiievo_tarasove",
    "tags": ["geo"]
  },
  {
    "wrong": ["Stanitsa Luganskaya"],
    "correct": "Stanytsia Luhanska",
    "id": "stanytsia_luhanska",
    "tags": ["geo"]
  },
  {
    "wrong": ["Chervonogrigorovka"],
    "correct": "Chervonohryhorivka",
    "id": "chervonohryhorivka",
    "tags": ["geo"]
  },
  {
    "wrong": ["Novgorod-Siverskiy", "Novgorod-Siversky"],
    "correct": "Novhorod-Siverskyi",
    "id": "novhorod_siverskyi",
    "tags": ["geo"]
  },
  {
    "wrong": ["Novograd-Volynskiy", "Novograd-Volynsky"],
    "correct": "Novohrad-Volynskyi",
    "id": "novohrad_volynskyi",
    "tags": ["geo"]
  },
  {
    "wrong": ["Starokonstantinov", "Starokonstyantyniv", "Starokostantinov", "Starokostyantyniv"],
    "correct": "Starokostiantyniv",
    "id": "starokostiantyniv",
    "tags": ["geo"]
  },
  {
    "wrong": ["Vitali Klichko", "Vitali Klitchko", "Vitali Klytschko", "Vitaliy Klitschko"],
    "correct": "Vitali Klitschko",
    "id": "vitali_klitschko",
    "tags": ["names"]
  },
  {
    "wrong": ["Blagoveshchenskoe", "Blagovishchenske", "Blahoveshchenskoe"],
    "correct": "Blahovishchenske",
    "id": "blahovishchenske",
    "tags": ["geo"]
  },
  {
    "wrong": ["Mogilev-Podolskiy", "Mogilev-Podolsky", "Mogilev-Podolskyi"],
    "correct": "Mohyliv-Podilskyi",
    "id": "mohyliv_podilskyi",
    "tags": ["geo"]
  },
  {
    "wrong": ["Verkhnedneprovsk", "Verkhnednieprovsk", "Verkhnednyeprovsk"],
    "correct": "Verkhnodniprovsk",
    "id": "verkhnodniprovsk",
    "tags": ["geo"]
  },
  {
    "wrong": ["Dobrovelichkovka"],
    "correct": "Dobrovelychkivka",
    "id": "dobrovelychkivka",
    "tags": ["geo"]
  },
  {
    "wrong": ["Gorishni Plavni", "Gorishnie Plavni"],
    "correct": "Horishni Plavni",
    "id": "horishni_plavni",
    "tags": ["geo"]
  },
  {
    "wrong": ["Kamen-Kashyrskyi"],
    "correct": "Kamin-Kashyrskyi",
    "id": "kamin_kashyrskyi",
    "tags": ["geo"]
  },
  {
    "wrong": ["Mala Danilovka", "Malaya Danilovka"],
    "correct": "Mala Danylivka",
    "id": "mala_danylivka",
    "tags": ["geo"]
  },
  {
    "wrong": ["Staraya Vyzhevka"],
    "correct": "Stara Vyzhivka",
    "id": "stara_vyzhivka",
    "tags": ["geo"]
  },
  {
    "wrong": ["Sudova Vyshnya", "Sudovaya Vishnya"],
    "correct": "Sudova Vyshnia",
    "id": "sudova_vyshnia",
    "tags": ["geo"]
  },
  {
    "wrong": ["Velikaya Dymerka"],
    "correct": "Velyka Dymerka",
    "id": "velyka_dymerka",
    "tags": ["geo"]
  },
  {
    "wrong": ["Velikiy Bereznyi"],
    "correct": "Velykyi Bereznyi",
    "id": "velykyi_bereznyi",
    "tags": ["geo"]
  },
  {
    "wrong": ["Dnepr", "Dnepropetrovsk", "Dnieper", "Dniepr", "Dniepropetrovsk", "Dnipropetrovsk"],
    "correct": "Dnipro",
    "id": "dnipro",
    "tags": ["geo"]
  },
  {
    "wrong": ["Ivano-Frankovsk"],
    "correct": "Ivano-Frankivsk",
    "id": "ivano_frankivsk",
    "tags": ["geo"]
  },
  {
    "wrong": ["Mangush", "Pershotravneve", "Pershotravnevoe", "Pershotravnevy"],
    "correct": "Manhush",
    "id": "manhush",
    "tags": ["geo"]
  },
  {
    "wrong": ["Molodogvardeysk"],
    "correct": "Molodohvardiisk",
    "id": "molodohvardiisk",
    "tags": ["geo"]
  },
  {
    "wrong": ["Novaya Borovaya"],
    "correct": "Nova Borova",
    "id": "nova_borova",
    "tags": ["geo"]
  },
  {
    "wrong": ["Novaya Kakhovka"],
    "correct": "Nova Kakhovka",
    "id": "nova_kakhovka",
    "tags": ["geo"]
  },
  {
    "wrong": ["Nova Mayachka", "Novaya Mayachka"],
    "correct": "Nova Maiachka",
    "id": "nova_maiachka",
    "tags": ["geo"]
  },
  {
    "wrong": ["Novie Sanzhary", "Novyie Sanzhary"],
    "correct": "Novi Sanzhary",
    "id": "novi_sanzhary",
    "tags": ["geo"]
  },
  {
    "wrong": ["Novomikolayivka", "Novomykolayivka", "Novonikolaevka"],
    "correct": "Novomykolaivka",
    "id": "novomykolaivka",
    "tags": ["geo"]
  },
  {
    "wrong": ["Severodonetsk", "Severskodonetsk"],
    "correct": "Siverskodonetsk",
    "id": "siverskodonetsk",
    "tags": ["geo"]
  },
  {
    "wrong": ["Stara Siniava", "Staraya Sinyava"],
    "correct": "Stara Syniava",
    "id": "stara_syniava",
    "tags": ["geo"]
  },
  {
    "wrong": ["Velikie Komyaty", "Velyki Komyaty"],
    "correct": "Velyki Komiaty",
    "id": "velyki_komiaty",
    "tags": ["geo"]
  },
  {
    "wrong": ["Velikodolinskoe"],
    "correct": "Velykodolynske",
    "id": "velykodolynske",
    "tags": ["geo"]
  },
  {
    "wrong": ["Velikiy Bychkov"],
    "correct": "Velykyi Bychkiv",
    "id": "velykyi_bychkiv",
    "tags": ["geo"]
  },
  {
    "wrong": ["Ukrzaliznitsa", "Ukrzaliznitsia", "Ukrzaliznycia"],
    "correct": "Ukrzaliznytsia",
    "id": "ukrzaliznytsia",
    "tags": ["geo"]
  },
  {
    "wrong": ["Slava Ukraina", "Slava Ukraine", "Slava Ukrajini"],
    "correct": "Slava Ukraini",
    "id": "slava_ukraini",
    "tags": ["geo"]
  },
  {
    "wrong": ["Belaya Tserkov", "Belaya Tserkva", "Bila Cerkva"],
    "correct": "Bila Tserkva",
    "id": "bila_tserkva",
    "tags": ["geo"]
  },
  {
    "wrong": ["Broshnev-Osada"],
    "correct": "Broshniv-Osada",
    "id": "broshniv_osada",
    "tags": ["geo"]
  },
  {
    "wrong": ["Dneprorudnoye", "Dnieprorudne", "Dnieprorudnoye"],
    "correct": "Dniprorudne",
    "id": "dniprorudne",
    "tags": ["geo"]
  },
  {
    "wrong": ["Gola Prystan", "Golaya Pristan"],
    "correct": "Hola Prystan",
    "id": "hola_prystan",
    "tags": ["geo"]
  },
  {
    "wrong": ["Kostiantinovka", "Kostyantinovka", "Kostyantynivka"],
    "correct": "Kostiantynivka",
    "id": "kostiantynivka",
    "tags": ["geo"]
  },
  {
    "wrong": ["Monastyrishche"],
    "correct": "Monastyryshche",
    "id": "monastyryshche",
    "tags": ["geo"]
  },
  {
    "wrong": ["Novoguyvinskoe", "Novohuivynskoe"],
    "correct": "Novohuivynske",
    "id": "novohuivynske",
    "tags": ["geo"]
  },
  {
    "wrong": ["Alexandriyskoe"],
    "correct": "Oleksandriiske",
    "id": "oleksandriiske",
    "tags": ["geo"]
  },
  {
    "wrong": ["Slobozhanskoe", "Slobozhanskoye"],
    "correct": "Slobozhanske",
    "id": "slobozhanske",
    "tags": ["geo"]
  },
  {
    "wrong": ["Velikie Luchki"],
    "correct": "Velyki Luchky",
    "id": "velyki_luchky",
    "tags": ["geo"]
  },
  {
    "wrong": ["Velikiy Dalnik"],
    "correct": "Velykyi Dalnyk",
    "id": "velykyi_dalnyk",
    "tags": ["geo"]
  },
  {
    "wrong": ["Geroyam Slava", "Heroyam Slava"],
    "correct": "Heroiam Slava",
    "id": "heroiam_slava",
    "tags": ["geo"]
  },
  {
    "wrong": ["Chernobaevka", "Chernobaivka", "Chernobayevka", "Chornobayivka"],
    "correct": "Chornobaivka",
    "id": "chornobaivka",
    "tags": ["geo"]
  },
  {
    "wrong": ["Gornostaevka", "Gornostayevka"],
    "correct": "Hornostaivka",
    "id": "hornostaivka",
    "tags": ["geo"]
  },
  {
    "wrong": ["Kotsiubinskoe", "Kotsubinskoe", "Kotsyubynske"],
    "correct": "Kotsiubynske",
    "id": "kotsiubynske",
    "tags": ["geo"]
  },
  {
    "wrong": ["Kropivnitskiy", "Kropivnitskyi"],
    "correct": "Kropyvnytskyi",
    "id": "kropyvnytskyi",
    "tags": ["geo"]
  },
  {
    "wrong": ["Krivoe Ozero", "Krivoye Ozero"],
    "correct": "Kryve Ozero",
    "id": "kryve_ozero",
    "tags": ["geo"]
  },
  {
    "wrong": ["Nizhnegorskiy", "Nyzhnogirskiy", "Nyznohirskyi"],
    "correct": "Nyzhnohirskyi",
    "id": "nyzhnohirskyi",
    "tags": ["geo"]
  },
  {
    "wrong": ["Aleksandrovsk"],
    "correct": "Oleksandrivsk",
    "id": "oleksandrivsk",
    "tags": ["geo"]
  },
  {
    "wrong": ["Pereshchepino"],
    "correct": "Pereshchepyne",
    "id": "pereshchepyne",
    "tags": ["geo"]
  },
  {
    "wrong": ["Petropavlovka"],
    "correct": "Petropavlivka",
    "id": "petropavlivka",
    "tags": ["geo"]
  },
  {
    "wrong": ["Rava-Russka", "Rava-Russkaya"],
    "correct": "Rava-Ruska",
    "id": "rava_ruska",
    "tags": ["geo"]
  },
  {
    "wrong": ["Shahtarske", "Shakhterske", "Shakhterskoye"],
    "correct": "Shakhtarske",
    "id": "shakhtarske",
    "tags": ["geo"]
  },
  {
    "wrong": ["Staryi Sambor"],
    "correct": "Staryi Sambir",
    "id": "staryi_sambir",
    "tags": ["geo"]
  },
  {
    "wrong": ["Velikie Mosty"],
    "correct": "Velyki Mosty",
    "id": "velyki_mosty",
    "tags": ["geo"]
  },
  {
    "wrong": ["Amvrosiyivka"],
    "correct": "Amvrosiivka",
    "id": "amvrosiivka",
    "tags": ["geo"]
  },
  {
    "wrong": ["Bakhchisarai"],
    "correct": "Bakhchysarai",
    "id": "bakhchysarai",
    "tags": ["geo"]
  },
  {
    "wrong": ["Belokurakino"],
    "correct": "Bilokurakyne",